English Question,Bengali Question,A,B,C,D,A Bn,B Bn,C Bn,D Bn,Correct Answer
In the body of which animal is there cell with characteristies named Cnidoblast?,কোন প্রানীর দেহে নিডোব্লাস্ট নামক বৈশিষ্ট্যপূর্ণ কোষ থাকে?,Hydra,Scypha,Mussels,Cockroach,হাইড্রা,স্কাইফা,ঝিনুক,আরশোলা,a
What happens if swelled dry grapes are kept in honey?,পানিতে ডুবানো ফুলে যাওয়া কিসমিস মধুতে রাখলে কী ঘটে?,Diffusion,Osmosis,Transpiration,Imbibition,ব্যাপন,অভিস্রবণ,প্রস্বেদন,ইমবাইবিশন,b
which step of mitosis cell division is transitory?,মাইটোসিস কোষ বিভাজনের কোন ধাপটি স্বল্পস্থায়ী?,Prophase,Anaphase,Metaphasc,Pro-metaphase,প্রোফেজ,এনাফেজ,মেটাফেজ,প্রো- মেটাফেজ,d
When a ray of light enters to wind medium from glass medium if the angle of incidence is 32 the refraton ray goes through the surface of separation medium. In this case whate is the refraction anlge?,আলো কাচ থেকে বায়ু মাধ্যমে যাওয়ার সময় আপতন কোণ ৩২^{\circ} হলে প্রতিসরিত রশ্নিটি মাধ্যমের বিভেদতল বরাবর যায়। এক্ষেত্রে প্রতিসরণ কোণের মান কত?,0^{\circ},32^{\circ},90^{\circ},180^{\circ},০^{\circ},৩২^{\circ},৯০^{\circ},১৮০^{\circ},c
Which hormone helps to heal wonds of plants?,উদ্ভিদের ক্ষতস্থান পূরণে সাহায্য করে কোন হরমোন?,Florigen,Ethylinc,Gibberellin,Indole acitic acid,ফ্লোরিজেন,ইথিলিন,জিব্বেরেলিন,ইন্ডোল অ্যাসেটিক এসিড,d
"There are fish, meat and milk in the daily food chart of Sabu. But there is no vegetables and coloured fruits.
 With which disease can Sabu be affected because of absent elements in his food chart?","সাবুর প্রতিদিন খাদ্য তালিকায় মাছ, মাংস ও দুধ থাকে। কিন্তু শাকসবজি ও রঙিন ফলমুল থাকে না। 
খাদ্য তালিকায় অনুপস্থি উপাদানগুলোর অভাবে সাবুর কোন রোগটি হতে পারে?",Scurvy,Rickets,Cretinism,Night Blindness,স্কার্ভি,রিকেটস,ক্লোটিনিজম,রাতকানা,d
"There are fish, meat and milk in the daily food chart of Sabu. But there is no vegetables and coloured fruits.
 The foods in Sabu's food chart-
 i. helps to body building 
 ii. Helps to produce energy 
 iii. Repairs the body
 Which on is correct?","সাবুর প্রতিদিন খাদ্য তালিকায় মাছ, মাংস ও দুধ থাকে। কিন্তু শাকসবজি ও রঙিন ফলমুল থাকে না।
সাবুর খাদ্য তালিকায় খাবারগুলো- 
 i. দেহ গঠনে সাহায্য করে
 ii. শক্তি উৎপাদনে সাহায্য করে
 iii. দেহের ক্ষয়পূরণ করে
 নিচের কোনটি সঠিক?",i & ii,i & iii,ii & iii,"i, ii & iii",i ও ii,i ও iii,ii ও iii,"i, ii ও iii",d
What type of scales is found in the bodyof hammer fish?,হাতুড়ি মাছের দেহে কোন ধরনের আইশ থাকে?,Cycloid,Ganoid,Placoid,Ctenoid,সাইক্লোয়েড,গ্যানয়েড,প্লাকয়েড,টিনয়েড,c
"CaO+ 2HCI\rightarrow \fbox{x}  + H_{2}O
 What is the compound X in the rection?",CaO+ 2HCI\rightarrow  \fbox{x}  + H_{2}O বিক্রিয়াটিতে X যৌগটি কী?,Base,Acid,Alkail,Salt,ক্ষার,এসিড,ক্ষারক,লবণ,d
Which of the following has its wons light?,কোনটির নিজস্ব আলো আছে?,Planet,star,Arificial satellite,Natural satellite,গ্রহ,নক্ষত্র,কৃত্রিম উপগ্রহ,প্রাকিৃতিকউপগ্রহ,b
"As a result of osmosis-
 i. cell sap of plant increase 
 ii. Petal of flowers closes or opens
 iii. Keeps stem and leaves fresh
 Which one of the following is correct?","অভিস্রবণের ফলে -
 i. উদ্ভিদ কোষের রসস্ফীতি ঘটে
 ii. ফুলের পাপড়ি বন্ধ বা খুলতে পারে
 iii. কান্ড ও পাতা সতেজ থাকে
 নিচের কোনটি সঠিক",i & ii,i & iii,ii & iii,"i, ii & iii",i ও ii,i ও iii,ii ও iii,"i, ii ও iii",d
The reproduction of which occurs through offset?,কোনটির প্রজনন অফসেটের মাধ্যমে হয়?,Spirodela,Minite,Onion,Guava,টোপাপানা,পুদিনা,পিঁয়াজ,পেয়ারা,a
"If the wighte of an object in the south pole is 49.15 Newton, What would its mass be?",দক্ষিণ মেরুতে কোন বস্তুর ওজন ৪৯.১৫ নিউটন হলে এর ভর কত?,5kg,9.78 kg,9.79 kg,9.80 kg,৫ কেজি,৯.৭৮ কেজি,৯.৭৯ কেজি,৯.৮০ কেজি,a
In which region of the rarth the value of acceleration due to gravity is 9.78m/sec^{2}?,পৃথিবীর কোন অঞ্চলে অভিকর্ষজ ত্বরণের মান৯.৭৮ মিটার/সেকেন্ড^{2} ?,in the polar region,In the eqator region,Tropical region,On the surface of the earth,মেরু অঞ্চলে,বিষুবীয় অঞ্চলে,ক্রাস্তীয় অঞ্চলে,পৃথিবীর পৃষ্ঠে,b
"S+O_{2}\xrightarrow[]{heat}X 
 Of what type is the reaction shown in thestem?","S+O_{2}\xrightarrow[]{তাপ}X
 উদ্দীপকের সংঘটিত বিক্রিয়াটি কোন ধরনের?",Decomposition reaction,Combustion reaction,Neutralization reaction,Substitution reaction,বিয়োজন বিক্রিয়া,দহন বিক্রিয়া,প্রশমন বিক্রিয়া,প্রতিস্থাপন বিক্রিয়া,b
"S+O_{2}\xrightarrow[]{heat}X 
 The X compound mentiond in the stem is-
 i. liquid
 ii. Having pungent fragrance 
 iii. Produced by direct contact of sulphur and xoygen
 Which one is correct?","S+O_{2}\xrightarrow[]{তাপ}X
উদ্দীপকের X যৌগটি- 
 i. তরল 
 ii. ঝাঝালো গন্ধবিশিষ্ট
 iii. সালফার ও অক্সিজেনের প্রত্যক্ষ সংযোগে উৎপন্ন হয়
 নিচের কোনটি সঠিক?",i & ii,i & iii,ii & iii,"i, ii & iii",i ও ii,i ও iii,ii ও iii,"i, ii ও iii",c
At which phase of mitosis cell division do half of the chromosome go towards northern polar region and the other half go towards southern ploar region and the other half go towards southern polar region?,মাইটোসিস কোষ বিভাজনের কোন ধাপে ক্রোমোজোমের অর্ধেক উত্তর মেরুর দিকে এবং অর্ধেক দক্ষিণ মেরুর দিকে গমন করে?,Prophase,Metaphase,Anaphase,Teloplase,প্রোফেজ,মেটাফেজ,অ্যানাফেজ,টেলোফেজ,c
Which molecule has more than one valency?,কোন মৌলের একাধিক যোজনী আছে?,Calcium Hydroxide,Silver,Florne,Led,ম্যাগনেসিয়াম,সিলভার,ফ্লোরিন,লেড,d
Which is permeable membrane?,কোনটি ভেদ্য পর্দা?,Cell wall,Cell membrane,Membrance of fish potka,Cell wall made up cutin,কোষপ্রাচীর,কোষ পর্দা,মাছের পটকার পর্দা,কিউটিনযুক্ত কোষপ্রাচীর,a
What type of satellite is used to detect the position of aeroplane?,বিমানের অবস্থান সঠিকভাবে নির্ণয়ের জন্য কোন ধরনের উপগ্রহের সহায়তা নিতে হয়?,Communication satellite,Navigation satellite,Weather satellite,Military satellite,যোগাযোগ উপগ্রহ,নৌ পরিবহন উপগ্রহ,আবহাওয়া উপগ্রহ,গোয়েন্দা উপগ্রগ,b
"Applicable for florgen-
 i. replaced to leaf let
 ii. Helps to transfrom buds into flower buds
 iii. Flower is produced in plant
 Which one is correct?","ফ্লোরিজেনের ক্ষেত্রে প্রযোজ্য-
 i. পত্রফলকে স্থানান্তরিত হয় 
 ii. পত্রমুকুলকে পুষ্পমুকুলে পরিণত করে
 iii. উদ্ভিদে ফুল উৎপন্ন হয়
 নিচের কোনটি সঠিক",i & ii,i & iii,ii & iii,"i, ii & iii",i ও ii,i ও iii,ii ও iii,"i, ii ও iii",c
What is atomic number of silicon?,সিলিকনের পারমাণবিক সংখ্যা কত?,14,15,16,17,14,15,16,17,a
"Hind brain-
 i. retains the balance of he body
 ii. Controls movement
 iii. Preserves heat
 Which on is correct?","লঘু মস্তিষ্ক- 
 i. দেহের ভারসাম্য রক্ষা করে
 ii. চলাফেরা নিয়ন্ত্রণ করে
 iii. তাপ সংরক্ষণ করে
 নিচের কোনটি সঠিক?",i & ii,i & iii,ii & iii,"i, ii & iii",i ও ii,i ও iii,ii ও iii,"i, ii ও iii",a
"In the bedroom of Esha's house, there are two tube lights and e one fan conndctied in paralled. Afuse of 10 ampere is used in the circuit of bedrood. 
 What is the appropriate fuse for the second element?","ইশার বাসার বেডরুমে দুটি টিউবলাইট ও একটি ফ্যান প্যারালালে সংযুক্ত করা হয়। বেডরুমের বর্তনীর সাথে ১০ অ্যাম্পিয়ার মানের ফিউজ ব্যবহার করা হয়। 
দ্বিতীয় উপকরণটির জন্য কার্যকরী ফিউজ কত?",5 ampere,10 ampere,15 ampere,30 ampere,৫ অ্যাম্পিয়ার,১০ অ্যাম্পিয়ার,১৫ অ্যাম্পিয়ার,৩০ অ্যাম্পিয়ার,a
"In the bedroom of Esha's house, there are two tube lights and e one fan conndctied in paralled. Afuse of 10 ampere is used in the circuit of bedrood. 
 If an eletric kettle is used in that room-
 i. the wire of the fuse will melt when the switch will be on.
 iii. tube light and fan will be damaged
 iii. there is a possibility of electic accident.
 Which one is correct?","ইশার বাসার বেডরুমে দুটি টিউবলাইট ও একটি ফ্যান প্যারালালে সংযুক্ত করা হয়। বেডরুমের বর্তনীর সাথে ১০ অ্যাম্পিয়ার মানের ফিউজ ব্যবহার করা হয়।
উক্ত বেডরুমে ইলেতট্রিত কেটিলি ব্যবহার করলে-
 i. সুচণ করলে ফিউজের তার গলে যাবে
 ii. টিউবলাইট ও ফ্যাণ নষ্ট হয়ে যাবে
 iii. বৈদ্যুতিক দূর্ঘটনা ঘটার সম্ভবনা আছে
 নিচের কোনটি সঠিক?",i & ii,i & iii,ii & iii,"i, ii & iii",i ও ii,i ও iii,ii ও iii,"i, ii ও iii",a
Two objdect of 25 kg and 30 kg mass are 10m far from each other. How is the force of attraction between these two objects?,২৫ কেজি ও ৩০ কেজি ভরের দুটি বস্তু পরষ্পর হতে ১০ মিটার দূরে আছে। এদের মধ্যবর্তী ক্রিয়াশীল আকর্ষণ বলের মান কত?,0.55G Newton,5.50 G Newtion,7.50G Newton,75.00 G Newton,০.৫৫ G নিউটন,৫.৫০ G নিউটন,৭.৫০ G নিউটন,৭৫.০০ G নিউটন,c
Which is the second level consumer in the Sundarbans?,সুন্দরবনের দ্বিতীয় স্তরের খাদক কোনটি?,"Monkey, Crain","Deer, Hen","Tiger, Crocodile","Inseect, Bird","বানর, সারস","হরিণ, মুরগি","বাঘ, কুমির","পোকামাকড়, পাখি",a
Which of the following flowers is large in size and has attractive colour?,কোন ফুল আকারে বড় এবং আকর্ষণী রংয়ের হয়?,Paddy,China rose,Shimul,Mustard,ধান,জবা,শিমুল,সরিষা,c
Where the value of 'g' is maximum?,কোথায় G এর মান বেশি?,At polar region,At the eqator,At the equinotical point,At the center of the earth,মেরু অঞ্চলে,বিষুবীয় অঞ্চলে,ক্রাস্তীয় অঞ্চলে,পৃথিবীর কেন্দ্রে,a
The animal of which phylum has haemocoel?,কোন পর্বের প্রাণীর হিমোসিল থাকে?,Nematoda,Annelida,Artropoda,Mollusca,নেমাটোডা,অ্যানেলিডা,আথ্রোপোডা,মলাস্কা,c
How many electrons are in the last orbit of phosphorus?,ফসফরাসের সর্ব শেষ শক্তিস্তরে কয়টি ইলেকট্রন থাকে,4,5,6,7,4,5,6,7,b
"The symptom of goiter is-
 i. voice becomes sharp 
 ii. Face trouble in swallowing of food
 iii. The gland presnet in throat becomes big
 Which one is correct?","গলগন্ড রোগের লক্ষণ- 
 i. গলার আওয়াজ তীক্ষ্ণ হয়
 ii. খাবার গিলতে অসুবিধা হয়
 iii. গলায় অবস্থিত গ্রন্থি বড় হতে থাকে
 নিচের কোনটি সঠিক?",i & ii,i & iii,ii & iii,"i, ii & iii",i ও ii,i ও iii,ii ও iii,"i, ii ও iii",c
In which stageof cell division nucleolus almost disappears?,কোষ বিভাজনের কোন ধাপে নিউক্লিওলাস প্রায় বিলুপ্ত হয়?,Prophase,Pro-metaphase,Metaphase,Anapase,প্রোফেজ,প্রো-মেটাফেজ,মেটাফেজ,অ্যানাফেজ,b
"X' is a physiological process of a plant which is occurred by stomata.
 Which one is occurred by mentioned process?"," উদ্ভিদের একটি শারীরবৃত্তীয় প্রক্রিয়া 'X' যা সম্পন্ন হয় পত্র রন্ধের মাধ্যমে। 
 উল্লেখিত প্রক্রিয়ার মাধ্যমে কোনটি ঘটে?",Water absorption,Salt absorption,Ion absorption,Loss of water,পাণি শোষণ,লবণ শোষণ,আয়ন শোষণ,পানি নির্গমন,d
"X' is a physiological process of a plant which is occurred by stomata.
 The pore of above stem is made of-
 i. upper epidermal cell 
 ii. Guard cell
 iii. Synergid cell
 Which one is correct?","উদ্ভিদের একটি শারীরবৃত্তীয় প্রক্রিয়া 'X' যা সম্পন্ন হয় পত্র রন্ধের মাধ্যমে।
উদ্দীপকের রন্ধ্রটি গঠিত হয়- 
 i. বহিঃত্বকীয় কোষ দ্বারা 
 ii. রক্ষীকোষ দ্বারা 
 iii. সহকারী কোষ দ্বারা
 নিচের কোনটি সঠিক",i & ii,i & iii,ii & iii,"i, ii & iii",i ও ii,i ও iii,ii ও iii,"i, ii ও iii",a
Which one is base?,কোনটি ক্ষারক?,NaOH,NH_{4}OH,Ca(OH)_{2},AI(OH)_{3},NaOH,NH_{4}OH,Ca(OH)_{2},AI(OH)_{3},d
Which one is the characteristic of hen?,মুরগির বৈশিষ্ট্য কোনটি?,Cold bloded animal,Cartilaginous skeleton,Skin with glands,It has beak,শীতল রক্তের প্রাণী,কঙ্কাল তরুণাস্থিময়,ত্বক গ্রন্থিযুক্ত,চক্ষু থাকে,d
Which one is a pure food?,কোনটি বিশুদ্ধ খাদ্য?,Sugar,Milk,Egg,Chira,চিনি,দুধ,ডিম,চিড়া,a
What is the valency of phosphate?,ফসফেটের যোজনী কত?,1,2,3,4,1,2,3,4,c
In which process the smell of Jasmine is spreaded out?,বেলি ফুলের গন্ধ ছড়িয়ে পড়ে কোন প্রক্রিয়ায়?,Diffusion,Osmosis,Transpiration,Imbibition,ব্যাপন,অভিস্রবণ,প্রস্বেদন,ইমবাইবিশন,a
The weight of a body on moon is 20 Newton. What is the weight of that body on earth,চাঁদে একটি বস্তুর ওজন ২০ নিউটন। পৃথিবীতে এর ওজন কত?,3.33 Newton,2.04 Newton,120 Newton,196 Newton,৩.৩৩ নিউটন,২.০৪ নিউটন,১২০ নিউটন,১৯৬ নিউটন,c
Which one does not change th colour of litmus paper?,কোনটি লিটমাসের বর্ণ পরির্বতন করে না?,HCI,NaCI,NH_{3},Ca(OH)_{2},HCI,NaCI,NH_{3},Ca(OH)_{2},b
Which part of the brain controls the respiration?,মস্তিষ্কের কোন অংশ শ্বসন নিয়ন্ত্রণ করে?,Cerebellum,Cerebrum,Pons,Medulla,সেরিবেলাম,সেরিব্রাম,পনস,মেডুলা,d
"In case of pumpkin flower-
 i. it is big in size 
 ii. It's pollen grains is sticky
 iii. It is scented petals with nectars 
 Which one is correct?","কুমড়া ফুল- 
 i. আকৃতিতে বড় 
 ii. এর পরাগরেণু আঁঠাযুক্ত 
 iii. মধুগ্রন্থিযুক্ত
 নিচের কোনটি সঠিক?",i & ii,i & iii,ii & iii,"i, ii & iii",i ও ii,i ও iii,ii ও iii,"i, ii ও iii",d
Which one is the growth retarding agents hormone?,বৃদ্ধি প্রতিবন্ধক হরমোন কোনটি?,Auxin,Gibberellin,Ethylene,Cytokinin,অক্সিন,জিব্বেরেলিন,ইথিলিন,সাইটোকইনিন,c
What is the atomic number of carbon?,কার্বনের পারমাণবিক সংখ্যা কত?,6,7,8,9,6,7,8,9,a
In which part of a plant meiosis cell division takes place?,উদ্ভিদের কোথায় মিয়োসিস কোষ বিভাজন ঘটে?,In stem,In buds,In viz,In stamen,কান্ডে,মুকুলে,ভ্রুণে,পরাগধনীতে,d
3 ampere electric current is passing through the 5 Ohm resistance. What is the potential difference?,৫ ওহম রোধের মধ্য দিয়ে ৩ অ্যাম্পিয়ার তড়িৎ প্রবাহিত হলে বিভব পার্থক্য কত?,0.6 volt,1.6 volt,8 volt,15 volt,০.৬ ভোল্ট,৬ ভোল্ট,৮ ভোল্ট,১৫ ভোল্ট,d
What is the valency of ammonium in (NH4)_{2} SO_{4}?,(NH_{4})_{2}2SO_{4} যৌগে অ্যামোনিয়ামের যোজনী কত?,1,2,3,4,1,2,3,4,a
What is the organic element of ecosystem?,বাস্তুতন্ত্রের জৈব উপাদান কোনটি?,soil,water,wind,dead orgnism,মাটি,পানি,বায়ু,মৃত জীব,d
"(1) Ca+ O_{2}\rightarrow Y' 
 (2) Y+CH_{3}COOH \rightarrow Z+ H_{2}O
 What type of reaction the no (1) reaction is?","নিচের বিক্রিয়া দুটির আলোকে ২৬ ও ২৭ নং প্রশ্নের উত্তর দাও: 
 (1) Ca+O_{2} \rightarrow  Y
 (2) Y + CH_{3}COOH \geq  Z+ H_{2}O 
 (1) নং বিক্রিয়াটি কোন ধরনের?",Combustion,Decomposition,Addition,Substitution,দহন,বিয়োজন,সংযোজন,প্রতিস্থাপন,a
"(1) Ca+ O_{2}\rightarrow Y' 
 (2) Y+CH_{3}COOH \rightarrow Z+ H_{2}O
 Z compound-
 i. is a neutral substance
 ii. Does not change the colour of litmus paper 
 iii. Produces in stomach 
 Which one is correct?","Z যৌগটি- 
 i. নিরপেক্ষ পদার্থ
 ii. লিটমাসের বর্ণ অপরিবর্তিত রাখে
 iii. পাকস্থলীতে উৎপন্ন হয়
 নিচের কোনটি সঠিক?",i & ii,i & iii,ii & iii,"i, ii & iii",i ও ii,i ও iii,ii ও iii,"i, ii ও iii",a
Which planet has maximum satellites?,কোন গ্রহের সবচেয়ে বেশি উপগ্রহ আছে?,Saturn,Jupiter,Uranus,Neptune,শনি,বৃহস্পতি,ইউরেনাস,নেপচুন,b
Which one is the most essential elements in fertilizer factory?,সার কারখানায় অতি প্রয়োজনীয় এসিড কোনটি?,H_{2}SO_{4},HNO_{3},HCI,HCIO_{4},H_{2}SO_{4},HNO_{3},HCI,HCIO_{4},a
Which is aggregate fruit?,কোনটি গুচ্ছ ফল?,Akando,Jack fruit,Balck Barry,Banana,আকন্দ,কাঁঠাল,জাম,কলা,a
Which is electrolyte material,কোনটি তড়িৎ বিশ্লেষ্য পদার্থ?,Sugar,Oil,Salt,`Glucose,চিনি,তেল,লবণ,গ্লুকোজ,c
A bulb of 100 volt is connected to an electric circuit of 5 ampere. What is the resistance of the circuit?,১০০ ভোল্টের একটি বাল্ব ৫ অ্যাম্পিয়ার তড়িৎপ্রবাহের বর্তনীতে সংযুক্ত করা হলো। বর্তনীর রোধ কত?,0.05 Ohm,20 Ohm,105 Ohm,500 Ohm,০.০৫ ও’ম,২০ ও’ম,১০৫ ও’ম,৫০০ ও’ম,b
Which is permeable membrane?,কোনটি ভেদ্য পর্দা?,Cell membrane,Cell wall,Membrance of fish potka,Membrance inside the egg shell,কোষ পর্দা,কোষপ্রাচীর,মাছের পটকার পর্দা,ডিমের খোসার পর্দা,b
From which disease is there a higher possibility of thick lips and mental retardation?,কোন রোগে ঠোঁট পুরু ও মানসিক প্রতিবন্ধী হওয়ার সম্ভাবনা বেশি থাকে?,Rickets,Goiter,Anemia,Cretinism,রিকেটস,গলগন্ড,অ্যানিমিয়অ,ক্রোটিনিজম,d
By which does the reproduction of sweet potato occer?,কোনটি দ্বারা মিষ্টি আলুর প্রজনন ঘটে?,Spore,Stem,Leaf,Root,অণুবীজ,কান্ড,পাতা,মূল,d
Of which element is Tritium an isotope?,ট্রিটিয়াম কোন মৌলের আইসোটোপ?,Hydrogen,Oxygen,Silicon,Carbon,হাইড্রোজেন,অক্সিজেন,সিলিকন,কার্বন,a
Which harmful substance does kidney sepatre from blood?,মানবদেহের ছাঁকনি যন্ত্রটি কোন বর্জ্য পদার্থ রক্ত থেকে পৃথক করে?,Carbon dioxide,Carbon monooxide,Urea,Sweat,কার্বন ডাই- অক্সাইড,কার্বন মনোক্সাইড,ইউরিয়া,ঘাম,c
What is the unit of current?,তড়িৎ প্রবাহের একক ক?,Ohm,Ampere,Coulomb,Volt,ও’ম,অ্যম্পিয়ার,কুলম্ব,ভোল্ট,b
How many atoms are there in amolecule of calcium sulphate?,ক্যালসিয়াম সাল ফেটের অণুতে কয়টি পরমাণু আছে?,1,2,3,6,1,2,3,6,d
Which flower dose not have coloured petals and sticky stigmas?,কোন ফুল বর্ণহীন এবং পরাগরেনু হালকা?,Mustard,Shimul,Aram,Paddy,সরিষা,শিমুল,কচু,ধান,d
