English Question,Bengali Question,A,B,C,D,A Bn,B Bn,C Bn,D Bn,Correct Answer
Which is the correct in the followings?,নিচের কোনটি সঠিক?,Imbibition\rightarrow Diffusion\rightarrow Osmosis \rightarrow Transpiration,Imbibition \rightarrow Osmosis\rightarrow Diffusion\rightarrow Transpiration,Imbibitionh\rightarrow Osmosis\rightarrow Rranspiration\rightarrow Diffusion,Imbibition\rightarrow Diffusion\rightarrow Transpiration\rightarrow Osmosis,ইমবাইবিশন\rightarrow  ব্যাপন \rightarrow  অভিস্রবণ\rightarrow  প্রস্বেদন,ইমবাইবিশন\rightarrow  অভিস্রবণ\rightarrow  ব্যাপণ\rightarrow  প্রস্বেদন,ইমবাইবিশন\rightarrow  অভিস্রবণ\rightarrow  প্রস্বেদন\rightarrow  ব্যাপন,ইমবাইবিশন\rightarrow  ব্যাপন\rightarrow  প্রস্বেদন \rightarrow অভিস্রবণ,b
What is the number of Neutron in Tritium?,ট্রিটিয়াম আইসোটোপে নিউট্রন সংখ্যা কত?,0,1,2,3,0,1,2,3,c
Which vitamin helps to increase number of platelets of bolld in body?,কোন ভিটামিন দেহের রক্তের অনুচক্রিকার সংখ্যা বৃদ্ধিতে সহায়তা করে?,B_{1},B_{2},B_{6},B_{12},বি_{১},বি_{২},বি_{৬},বি_{১২},d
Which acid is present inTomato?,টমেটেতে কোন এসিড বিদ্যমান?,Nitric acid,Carbolic acid,Oxalic acid,Ascorbic acid,নাইট্রিক এসিড,কার্বলিক এসিড,অক্সালিক এসিড,এসকরবিক এসিড,c
Weight of Mr. X is 65 Kgs. How much amout of carbohydrate he needs daily?,মি. X এর ওজন ৬৫ কেজি। তার দৈনিক কত গ্রাম শর্করা প্রয়োজন?,14.13 gram,260 gram,299 gram,585 gram,১৪.১৩ গ্রাম,২৬০ গ্রাম,২৯৯ গ্রাম,৫৮৫ গ্রাম,c
Which level of consumer the deer belongs to?,হরিণ কোন স্তরের খাদক?,First,Second,Third,Omnivorous,১ম,২য়,৩য়,সর্বভূক,a
Which hormone acts as growth retarding agent for plants,কোন হরমোন উদ্ভিদের বৃদ্ধি প্রতিবন্ধক হিসাবে কাজ করে?,Auxin,Abscisic acid,Cytokinin,Gebberellin,অক্সিন,অ্যাবসাইসিক এসিড,সাইটোকাইনিন,জিব্বেরেলিন,b
Which relation is correct?,কোন সম্পর্কটি সঠিক?,Hydra\rightarrow Cnidoblast cell,Earth worm \rightarrow Flame cell,Tape worm\rightarrow Nephridia,Roud worm\rightarrow Haemocoel,হাইড্রো\rightarrow  নিডোব্লাস্ট কোষ,কেঁচো\rightarrow  শিখা অঙ্গ,ফিতাকৃমি \rightarrow  নেফ্রিডিয়া,গোলকৃমি\rightarrow  হিমোসিল,a
Which one is the feature of meiosis cell division?,মিয়োসিস কোষ বিভাজনের বৈশিষ্ট্য কোনটি?,It takes place in somatic cell,It is an equational division,Nucleus divides only once,Cromosome divides only once,এডি দেহকোষে ঘটে,এটি সমীকরণিক বিভাজন,নিউক্লিয়াসটি একবার বিভাজিত হয়,ক্রোমোজোম একবার বিভাজিত হয়,d
In which one reproduction through root occurs?,মূলের মাধ্যমে প্রজনন হয় কোনটি?,Ginger,Onion,Gralic,Patol,আদার,পিয়াজের,রসুনের,পটল,d
What is the international Unit of mass?,আন্তর্জাতিক পদ্ধতিতে ভরের একক কোনটি?,Newton,Kilogram,Gram,Metric ton,নিউটন,কিলোগ্রাম,গ্রাম,মেট্রিক টন,b
"Which one is the incidence angle for total internal reflection, while the cirtical angle is 60?",সংকট কোণের মান ৬০^{\circ} হলে পূর্ণ-অভ্যন্তরীণ প্রতিফলনের জন্য আপতন কোণের মান কোনটি?,30^{\circ},45^{\circ},60^{\circ},75^{\circ},৩০^{\circ},৪৫^{\circ},৬০^{\circ},৭৫^{\circ},d
Which one is an animal pollinated flower?,প্রাণিপরাগী ফুল কোনটি?,Paddy,Shimul,China-rose,Mustard,ধান,শিমুল,জবা,সরিষা,b
Unusually repid palapitation is the symptom of which disease?,বুক ধড়ফড় করা কোন রোগের লক্ষণ?,Cretinis,Anemia,Goiter,Scurvy,ক্রোটিনিজম,অ্যানিমিয়া,গলগন্ড,স্কার্ভি,b
Which acid of the following is edible?,নিচেরর কোন এসিডটি খাওয়ার ‍উপযোগী?,Phosphoric acid,Malic acid,Perchoric acid,Hydrochloric acid,ফসফরিক এসিড,ম্যালিক এসিড,পারক্লোরিক এসিড,হাইড্রোক্লোরিক এসিড,b
"By green plants, the solar enery transforms into which energy?",সবুজ উদ্ভিদের মাধ্যমে সৌরশক্তি কোন শক্তিতে রূপান্তরিত হয়?,Chemical energy,Heat energy,Mechanical energy,Light energy,‘রাসায়নিক শক্তি,তাপ শক্তি,যান্ত্রিক শক্তি,আলোক শক্তি,a
Which one is used in magnifying glass?,ম্যাগনিফাইং গ্লাসে কোনটি ব্যবহৃত হয়?,Concave lens,Concave mirror,Convex lens,Convex mirror,অবতল লেন্স,অবতল দর্পণ,উত্তল লেন্স,উত্তল দর্পণ,c
Which panet has the highest number of satellites?,নিচের কোন গ্রহের উপগ্রহ সংখ্যা সবচেয়ে বেশি?,Mars,Earth,Uranus,Neptune,মঙ্গল,পৃথিবী,ইউরেনাস,নেপচুন,c
Which part of the brain controls our swallowing and breathing?,মস্তিষ্কের কোন অংশ আমাদের খাদ্য গ্রহণ ও শ্বসন নিয়ন্ত্রণ করে?,Cerebellum,Pons,Modulla,Cerebrum,সেরিবেলাম,পনৃস,মেডুলা,সেরিব্রাম,c
