English Question,Bengali Question,A,B,C,D,A Bn,B Bn,C Bn,D Bn,Correct Answer
"Read the following Passage and answer to the question no. 16 and 17: 
 A science teacher was discussing about cell division the class. He said that though there are four chromosomes at initial stage of cell division at the last stage there are two chromosomes. 
 As per the stem where does the cell divison occur?","বিজ্ঞান শিক্ষক শ্রেণিতে একটি কোষ বিভাজন নিয়ে আলোচনা করছিলেন। তিনি এ সময় বললেন, এতে প্রথম পর্যায়ে প্রতিটি কোষে চারটি ক্রোমোজোম থাকলেও শেষ ধাপে এস দুটি ক্রোমোজোমে পরিণত হয়। 
 উদ্দীপকের কোষ বিভাজনটি কোথায় সংঘটিত হয়?",Inside the stamen,Apex of root,Buds,In the stem,উদ্ভিদের পরাগধনীতে,মূলের অগ্রভাগে,মুকুলে,কান্ডে,a
"After the mentiond cell disision the cells will be-
 i. gamete 
 ii. Diploid 
 iii. Haploid","বিজ্ঞান শিক্ষক শ্রেণিতে একটি কোষ বিভাজন নিয়ে আলোচনা করছিলেন। তিনি এ সময় বললেন, এতে প্রথম পর্যায়ে প্রতিটি কোষে চারটি ক্রোমোজোম থাকলেও শেষ ধাপে এস দুটি ক্রোমোজোমে পরিণত হয়। 
উল্লেখিত বিভাজনটি সংঘটনের পর কোষগুলো হবে-
 i. জননকোষ 
 ii. ডিপ্লয়েড 
 iii. হ্যাপ্লয়েড",i & ii,i & iii,ii & iii,"I, ii & iii",i ও ii,i ও iii,ii ও iii,"i, ii ও iii",b
Which part of human eyes is translucent?,মানচক্ষুর আলোকগ্রাহী অংশ কোনটি?,Retina,Pupil,Irish,Sclera,রেটিনা,তারারন্ধ্র,আইরিশ,শ্বেতমন্ডল,a
Which planet of the solar system has the third highest number of satellites?,সৌরজগতের তৃতীয় সর্বোচ্চ উপগ্রহ রয়েছে কোন গ্রহের?,Satum,Neptune,Jupiter,Urenus,শনি,নেপচুন,বৃহস্পতি,ইউরেনাস,d
Which of the following has citric acid?,কোনটিতে সাইট্রিক এসিড রয়েছে?,Orange,Tamarind,Tomato,Apple,কমলা,তেতুঁল,টমেটো,আপেল,a
Which one of the following helps to overcome dormancy of seeds?,কোনটি বীজের সুপ্তাবস্থা কাটাতে সাহায্য করে?,Auxin,Florigen,Ethylene,Gibberellin,অক্সিজেন,ফ্লোরিজেন,ইথিলিন,জিব্বেরেলিন,d
Which protein has easily quotient I?,কোন আমিষের সহজ পাচ্যতার গুণক ১?,Fish,Meat,Pulse,Egg,মাছ,মাংস,ডাল,ডিম,d
Which is the main element of producing soap?,কোনটি সাবান তৈরির মূল উপাদান,AI(OH)_{3},Ca(OH)_{2},NaOH,NH_{4}OH,A1(OH)_{3},Ca(OH)_{2},NaOH,NH_{4}OH,c
"If the distance between two objects is increased four times, how would the attraction force between them be?","দুটি বস্তুর মধ্যবর্তী দূরত্ব চারগুণ করা হলে এদের মধ্যবর্তী আকর্ষণ বল কত হবে? 
 .",\frac{1}{4},\frac{1}{16},4 times,16 times,\frac{১}{৪},\frac{১}{১৬},৪ গুন,১৬ গুন,b
Where is the weight of an object the highest?,বস্তুর ওজন কোথায় সবচেয়ে বেশি হয়?,At the centre of the earth,At the polar region,At the equator,At the surface of the earth,পৃথিবীর কেন্দ্রে,মেরু অঞ্চলে,বিষুব অঞ্চলে,ভূ-পৃষ্ঠে,b
"NaOH+A\rightarrow Na_{2}SO_{4}+H_{2}O
 How many atoms are there in first reactant compound of the reaction?","NaOH+A\rightarrow Na_{2}SO_{4}+H_{2}O
 বিক্রিয়ক প্রথম যৌগের পরমাণু সংখ্যা কয়টি?",1,2,3,4,১টি,২টি,৩টি,৪টি,c
"NaOH+A\rightarrow Na_{2}SO_{4}+H_{2}O
 The compound 'A' is used - 
 i. to digest food 
 ii. In fertilizer industry 
 iii. In producing rayon 
 Which one is correct?","NaOH+A\rightarrow Na_{2}SO_{4}+H_{2}O‍
A যৌগটি ব্যবহৃত হয়- 
 i. খাদ্যদ্রব্য হজম করতে
 ii. সার কারখানায়
 iii. রেয়ন তৈরিতে 
 নিচের কোনটি সঠিক?",i & ii,i & iii,ii & iii,"I, ii & iii",i ও ii,i ও iii,ii ও iii,"i, ii ও iii",c
Which is the tertiary consumer in the ecosystem of pond?,পুকুরের বাস্তুসংসস্থানে কোনটি তৃতীয় স্তরের খাদক?,Frog,Tortoise,Mussels,Small fish,ব্যাঙ,কচ্ছপ,ঝিনুক,ছোট মাছ,b
Which is appropriate to remove acidity in the stomach?,পাকস্থলীর এসিডিটি নিরাময়ে কোনটি উপযোগী?,Calcium Hydroxide,Acetic Acid,Aluminium Hydroxide,Ammonium Hydroxide,ক্যালসিয়াম,এসিটিক এসিড,অ্যলুমিনিয়াম হাইড্রোক্সাইড,অ্যামোনিয়াম হাইড্রোক্সাইড,c
The skin of which animal is dry?,কোন প্রাণীটির ত্বক শুষ্ক?,Hilsha,Shark,Snake,Toad,ইলিশ,হাঙ্গর,সাপ,কুনোব্যাঙ,c
Which of the following is called cold blooded animal?,নিচের কোটি শীতল রক্ত বিশিষ্ট্য প্রাণী?,Toad,Hilsa fish,Wall lizard,Crocodile,কুনোব্যাঙ,ইলিশ মাছ,টিকটিকি,কুমির,a
Which of the following occurs meisosis cell division?,নিচের কোনটিতে মিয়োসিস কোষ বিভাজন ঘটে?,Ffloral axis,Apex of root,Buds,stamen,ভ্রুণ মুকুল,মূলের অগ্রভাগ,মুকুল,পরাগধানী,d
"Ethylene in plants-
 i. act as prevent growth 
 ii. Produce flower 
 iii. Brake the sleepood of buds
 Which one is correct?","উদ্ভিদের ইথিলিন-
 i. বৃদ্ধি প্রতিবন্ধক হিসেবে কাজ করে
 ii. ফুল উৎপন্ন করে
 iii. মুকুলের সুপ্তাবস্থা ভঙ্গ করে
 নিচের কোনটি সঠিক?",i & ii,i & iii,ii & iii,"i, ii & iii",i ও ii,i ও iii,ii ও iii,"i, ii ও iii",d
Which of the following plants occour cross pollination?,পর পরাগায়ন নিচের কোন উদ্ভিদটিতে ঘটে?,Mustard,Pumkin,Dutura,Shimul,সরিষা,কুমড়া,ধুতুরা,শিমুল,d
Which of the followings is fleshy fruits?,নিচের কোনটি রসালো ফল?,Custard apple,Banana,Pineapple,Jackfruit,আতা,কলা,আনারস,কাঁঠাল,b
Which of the following is called the stalk of the brain?,নিচের কোনটিকে মস্তিষ্কের বোটা বলা হয়?,pons,cerebellum,medulla,thalamus,পনস,সেরিবেলাম,মেডুলা,থ্যালামাস,c
How many proton is an oxygen atom?,অক্সিজেন পরমাণুতে কতটি প্রোটিন থাকে?,Two,Eight,Sixteen,Thirty two,দুই,আট,ষোল,বত্রিশ,b
How many electrons can stay in 4th orbit of an atom?,কোনো মৌলের চতুর্থ শক্তি স্তরে সর্বোাচ্চ কতটি ইলেকট্রন থাকতে পারে,8,18,32,50,8,18,32,50,c
A body of mass is 30 kg in Dhaka. How much weight in Newton of the body?,৩০ কেজি ভরের কোন বস্তুর ওজন ঢাকাতে কত নিউটন হবে?,48.9,293.4,294,294.9,48.9,293.4,294,294.4,c
Which is the formula of quicklime?,কুইক লাইমের সংকেত কোনটি?,Mg(OH)_{2},AI(OH)_{3},Ca(OH)_{2},KOH,Mg(OH)_{2},AI(OH)_{2},Ca(OH)_{2},KOH,c
Which of the following is the characteristics of Fuses?,নিচের কোনটি ফিউজের বৈশিষ্ট্য?,Made of alliy,The wire is thick,High melted,Never get hot,সংকর ধাতুর তৈরি,তারটি মোটা হয়,উচ্চ গলনাংকবিশিষ্ট,কখনও উত্তপ্ত হয় না,a
Which is most essentia acid ina fertilizer factory?,সার কারখানায় অতি প্রয়োজনীয় এসিড কোনটি?,HCI,H_{2}SO_{4},HNO_{3},H_{3}PO_{4},HCI,H_{2}SO_{4},HNO_{3},H_{3}PO_{4},b
Which palet has 67 Satellites?,নিচের কোন গ্রহের বাষট্টিটি উপগ্রহ আছে?,Jupiter,Saturn,Uranus,Neptune,বৃহষ্পতি,শনি,ইউরেনাস,নেপচুন,b
Which is the function of the earth observation satellite?,পৃথিবীর পর্যবেক্ষণকারী উপগ্রহের কাজ কোনটি?,Locate the exact positions of Biman on the sky,Observe the possible leakage of oil from ships in the sea,Observe the space where the cloud is formed,Support to relay the radio signal,আকাশে বিমানের অবস্থা জানা,সমুদ্রে জাহাজের জন্য তেল চুইয়ে পড়া পর্যবেক্ষণ,মেঘ সৃষ্টি হওয়ার স্থান পর্যবেক্ষণ,তোর সংকেত প্রেরণে সহায়তা করা,b
"Joni a student of class two, does not see clearly at the time being sunset. 
 Which group of food of the following is needed for Joni?",দ্বিতীয় শ্রেণির ছাত্র জনি সূযাস্তের পর ঠিকভাবে দেখতে পায় না। জনির নিচের কোন জাতীয় খাদ্য গুচ্ছ খাওয়া প্রয়োজন?,"Edible oil, Cabbage","Fish liver oil, Palong Shak","Egg yolk, Cauliflower","Soybean oil, Lettuce","ভোজ্য তেল, বাঁধাকপি","মাছের তেল, পালং শাক","ডিমের কুসুম, ফুলকপি","সয়াবিন তেল, লেটুস পাতা",b
How many percent of current wiil be save when it is used pressure cooker for cook?,প্রেসার কুকারে রান্না করলে শতকরা কত ভাগ বিদ্যুৎ সাশ্রয় হয়?,10,15,20,25,10,15,20,25,d
Which of the following is honey glandless flower?,নিচের কোনটি মধুগ্রন্থিহীন ফূল?,Kadom,Paddy,Arum,Shimul,কদম,ধান,কচু,শিমুল,b
What is the mass number of second isotope of Carbon?,কার্বনের দ্বিতীয় আইসোটোপের ভরসংখ্যা কত?,7,8,12,13,7,8,12,13,d
Which of the folloving is non-electrolyte?,নিচের কোনটি তড়িৎ অবিশ্লেষ্য পদার্থ?,Sugar,Table salt,Tunte,Citric Acid,চিনি,খাদ্য লবণ,তুঁতে,সাইট্রিক এসিড,a
How much kilo calories of energy is produced from 25 grams of carbohydrate and 25 grams of carbohydrate and 25 grams of protein?,২৫ গ্রাম শর্করা ও ২৫ গ্রাম আমিষ থেকে মোট কত কিলোক্যালরি শক্তি উৎপন্ন হয়?,450,325,200,50,৪৫০ কিলোক্যালরি,৩২৫কিলোক্যালরি,২০০ কিলোক্যালরি,৫০ কিলোক্যালরি,c
Which substance is Coloidal?,কলয়েডধর্মী পদার্থ কোনটি?,Polythene,Gelatine,Cutine,Vaseline,পলিথিন,জিলেটিন,কিউটিন,ভেসলিন,b
Which one contain the correct eye shape?,চোখের আকৃতি ঠিক রাখে কোনটি?,Seler,Cornea,Eye-ball,Iris,শ্বেতমন্ডল,কার্ণিয়া,অক্ষিগোলক,আইরিশ,a
Where produce the florigen hormone?,ফ্লোরিজেন নামক হরমোন কোথায় উৎপন্ন হয়?,In the root,In the stem,In the leaf,In the flower,মূলে,কান্ডে,পাতায়,ফুলে,c
Which vitamin found in foodgrains?,শস্যদানায় কোন ভিটামিন পাওয়া যায়?,K,D,E,C,কে,বি,ই,সি,c
Which on is stolon?,কোনটি স্টোলন?,Ginger,Garlic,Potato,Pudina,আদা,রসুন,আলু,পুদিনা,d
Which is the lower parts of the main part of human brain?,মানব মস্তিষ্কের প্রধান অংশের নিচের অংশগুলো কী কী?,Thalamus and pons,Medulla and pons,Thalamus and Hypothalamus,Hypothalamus and Medulla,থ্যালামাস ও পনস,মেডুলা ও পনস,থ্যালামাস ও হাইপোথ্যালস,হাইপোথ্যালামাস ও মেডুলা,c
Which animal's body bears flame cell?,কোন প্রাণীর দেহে শিখা অঙ্গ থাকে?,Crab,Earthworm,Roundworm,Tapeworm,কাঁকড়া,কেঁচো,গোলকৃমি,ফিতাকৃমি,d
Which of the follwing is related with the process of osmosis?,নিচের কোনটি অভ্রিস্রবণ প্রক্রিয়ার সাথে সম্পর্কিত?,Xylem tissue,Phloem tissue,Downward transportation,Reversible transportaton,জাইলেম টিস্যু,ফ্লোয়েম টিস্যু,নিম্নমুখী পরিবহন,উভমুখী পরিবহন,a
In which stage the daughter chromosome reached their opposite poles?,অপত্য ক্রোমোজোমগুলো বিপরীত মেরুতে আসে কোন ধাপে?,Pro-metaphase,Metaphase,Anaphase,Telophase,প্রো-মেটাফেজ,মেটাফেজ,অ্যানাফেজ,টেলোফেজ,d
"In the mentioned process-
 i. plants release body water through transpiration 
 ii. Plants absorb carbon dioxide for photosynthesis
 iii. Carrying Oxygen from lymph to cell 
 Which one is correct?","মিতু বেকারীর পাশ দেয় স্কুলে যাওয়ার সময় লক্ষ করল বেকারীর তৈরি বিস্কুটের সুবাসে চারপাশ ভরে গেছে। উক্ত কার্যক্রমের সাথে মিতু তার পাঠ্যবিইয়ের একটি বিশেষ প্রক্রিয়অর মিল পেল।
উল্লিখিত প্রক্রিয়ার-
 i. উদ্ভিদ দেহ থেকে প্রস্বেদনের মাধ্যমে পানি নিষ্কাশন করে
 ii. উদ্ভিদ সালোকসংশ্লেষণের জন্য কার্বন ডাইঅক্সাইড গ্রহণ করে
 iii. লাসিকা থেকে কোষ অক্সিজেন পরিবহন করে
 নিচের কোনটি সঠিক",i & ii,i & iii,ii & iii,"i, ii & iii",i ও ii,i ও iii,ii ও iii,"i, ii ও iii",d
Which prevents inhibiting the process of abscission of fruits?,ফলের অকালে ঝরে পড়া রোধ হয় নিচের কোনটির প্রভাবে?,Ethylene,Cytokinin,Auxin,Gibberellin,ইথিলিন,সাইটোকাইনিন,অক্সিন,জিব্বেরেলিন,c
How much weight of a 1kg mass object at the eqinoctial point?,ক্রান্তীয় অঞ্চলে ১ কেজি ভরের বস্তুর ওজন কত?,9.78 N,9.79 N,9.80 N,9.83 N,৯.৭৮ নিউটন,৯.৭৯ নিউটন,৯.৮০ নিউটন,৯.৮৩ নিউটন,b
Which is the lower parts of the main part of human brain?,মানব মস্তিষ্কের প্রধান অংশের নিচের অংশগুলো কী কী?,Thalamus and pons,Mesulla and Pons,Thalamus and Hypothalamus,Hypothalamus and Medulla,থ্যালামাস ও পনস,মেডুলা ও পনস,থ্যালামাস ও হাইপোথ্যালঅমাস,হাইপোথ্যালামাস ও মেডুলা,c
"The electronic configuration of an element is 2,8,5 - Which is the element?","একটি মৌলের ইলেকট্রন বিন্যাস ২, ৮,৫ হলে মৌলটি কী?",Chlorine,Fluorine,Sulphur,Phosphorus,ক্লোরিন,ফ্লোরিন,সালফার,ফসফরাস,d
What is the mass number of second isotope of Carbon?,কার্বনের দ্বিতীয় আইসোটোপের ভরসংখ্যা কত?,7,8,12,13,7,8,12,13,d
What is the chemical name of vinegar?,ভিনেগারের রাসায়নিক নাম কী?,Cirtic acid,Acetic Acid,Maleic Acid,Hydrochloric acid,সাইট্রিক এসিড,এসিটিক এসিড,ম্যালিক এসিড,হাইড্রোক্লোরিক এসিড,b
Which part of the following protectes the eye from external harmfrl effects?,নিচের কোন অংশটি চক্ষুকে বাহিরের বিভিন্ন প্রকার অনিষ্ট হতে রক্ষা করে?,Sclcra,Iris,Eye-ball,Cornea,শ্বেতমন্ডল,আইরিস,অক্ষিগোলক,কর্ণিয়া,a
"Protein is formed by-
 i. Oxygen and Chlorine 
 ii. Carbon and Hydrogen 
 iii. Sulphur and Nitrogen 
 Which one is correct?","আমিষ গঠিত হয়-
 i. অক্সিজেন ও ক্লোরিন দিয়ে
 ii. কার্বন ও হাইড্রোজেন দিয়ে
 iii. সালফার ও নাইট্রোজেন দিয়ে 
 নিচের কোনটি সঠিক?",i & ii,i & iii,ii & iii,"i, ii & iii",i ও ii,i ও iii,ii ও iii,"i, ii ও iii",c
In a drycell which of the following acts as cathode?,শুষ্ককোষে কোনটি ব্যাথোড হিসাবে কাজ করে?,manganese dioxide,carbon rod,Zinc container,Metal cap,ম্যাঙ্গানিজ ডাইঅক্সাইড,কার্বন দন্ড,দস্তার চোঙ,ধাতব টুপি,*
"The value of the weight of an object-
 i. depends on its mass 
 ii. Difference in different places 
 iii. Is maximum in pole region 
 Which on is correct?","বস্তুর ওজনের মান- 
 i. বস্তুর ভরের উপর নির্ভরশীল 
 ii. স্থানভেদে ভিন্ন হয় 
 iii. মেরু অঞ্চলে সবচেয়ে বেশি
 নিচের কোনটি সঠিক?",i & ii,i & iii,ii & iii,"i, ii & iii",i ও ii,i ও iii,ii ও iii,"i, ii ও iii",d
"(i) CaCO_{3}\xrightarrow[]{Heat}'X' + CO_{2}
 (ii) 'X' + H_{2}O\rightarrow 'Y'
 Which is the characteristics of 'X'compound?","(i) CaCO_{3}\xrightarrow[]{তাপ}'X' + CO_{2}
(ii) 'X' + H_{2}O\rightarrow 'Y'
x যৌগের বৈশিষ্ট্য কোনটি?",Gives H+ ion water solution,It feels slippery when touched,Ncutral substance,Does not dissolve in water,জলীয় দ্রবণে H আয়ন দেয়,স্পর্শ করলে পিচ্ছিল অনুভূত হয়,নিরপেক্ষ জাতীয় পদার্থ,পানিতে অদ্রবণীয়,b
"(i) CaCO_{3}\xrightarrow[]{Heat}'X' + CO_{2}
 (ii) 'X' + H_{2}O\rightarrow 'Y'
 According to the reaction(ii)- 
 i. 'Y' dissolves in water very slightly 
 ii. 'Y' is a slat 
 iii. Huge heat energy is produced in the reaction 
 Which on is correct?","(i) CaCO_{3}\xrightarrow[]{তাপ}'X' + CO_{2}
(ii) 'X' + H_{2}O\rightarrow 'Y'
(ii) নং বিক্রিয়ার ক্ষেত্রে- 
 i. Y পানিতে খুব অল্প দ্রবীভূত হয় 
 ii. Y একটি লবণ 
 iii. বিক্রিয়াটিতে প্রচুর পরিমাণ তাপ উৎপন্ন হয় 
 নিচের কোনটি সঠিক?",i & ii,i & iii,ii & iii,"i, ii & iii",i ও ii,i ও iii,ii ও iii,"i, ii ও iii",b
Which of the following is the characteristics of Fuses?,নিচের কোনটি ফিউজের বৈশিষ্ট্য?,Made from alloy,The wire is thick,High melted,Never get hot,সংকর ধাতুর তৈরি,তারটি মোটা হয়,উচ্চ গলনাংকবিশিষ্ট,কখনও উত্তপ্ত হয় না,a
"If the vlotage difference between the two ends of a conductor is 10 volt and current flowing through it is 5 ampere, what will be the resistance of the conductor?","১০ ভোল্ট বিভব পার্থক্য বিশিষ্ট্য কোনো পরিবাহকের মধ্য দিয়ে ৫ অ্যাম্পিয়ার বিদ্যুৎ প্রবাহিত হলে, ঐ পরিবাহীর রোধ কত হবে?",2 Ohms,5 Ohms,10 Ohms,50 Ohms,২ ওহম,৫ ওহম,‍১০ ওহম,৫০ ওহম,a
What thype of fruit is banana?,কলা কোন ধরনের ফল?,Dry fruit,Aggregate fruit,Multiple fruit,Fleshy fruit,নীরস ফল,গুচ্ছ ফল,যৌগিক ফল,রসালো ফল,d
Where produce the florigen hormone?,ফ্লোরিজেন নামক হরমোন কোথায় উৎপন্ন হয়?,In the root,In the stem,In the leaf,In the flower,মূলে,কান্ডে,পাতায়,ফূলে,c
Which vitamin is found in food grains?,শস্যদানায় কোন ভিটামিন পাওয়া যায়?,K,D,E,C,কে,ডি,ই,সি,c
Which one is the correct food chain,সঠিক খাদ্য-শৃঙ্খল কোনটি?,Grass\rightarrow Phytoplankton\rightarrow Zooplankton,Zooplankot\rightarrow Phytoplankton\rightarrow Small fish,Phytoplankton\rightarrow Zooplankton\rightarrow Small fish,Grass\rightarrow Frog\rightarrow Tiger,ঘাস \rightarrow  ফাইটোপ্ল্যাংকটন \rightarrow  জুপ্লাঙ্কটন,জু-প্লাঙ্কটন \rightarrow  ফাইটোপ্ল্যাংকটন\rightarrow  ছোটমাস,ফাইটোপ্লাঙ্কটন \rightarrow  জু-প্লাঙ্কটন \rightarrow  ছোটমাছ,ঘাস\rightarrow  ব্যাঙ\rightarrow  বাঘ,c
Which planet has 27 satellites?,২৭ টি উপগ্রহ আছে কোন গ্রহের?,Jupiter,Saturn,Uranus,Neptune,বৃহস্পতি,শনি,ইউরেনাস,নেপচুন,c
Which one is pure food?,নিচের কোনটি বিশুদ্ধ খাদ্য?,Millk,Guava,Egg,Sugar,দুধ,পেয়ারা,ডিম,চিনি,d
How much kilocalories of energy is produced from 25 grams of carbohydrate and 25 grams of protein?,২৫ গ্রাম শর্করা ও ২৫ গ্রাম আমিষ থেকে মোট কত কিলোক্যালরি শক্তি উৎপন্ন হয়?,50,200,325,450,50,200,325,450,b
"Pumpkin is- 
 i. Large flower and petals with nectars
 ii. Pollen granis and stigmas are sticky
 iiii. Coloured and scented petals
 Which one is correct?","কুমড়া- 
 i. ফুল বড় এবং মধুগ্রন্থিযুক্ত 
 ii. ফুলের পরাগরেণু ও গর্ভমুন্ড আঠালো 
 iii. ফুল রঙিন ও সুগন্ধযুক্ত
 নিচের কোনটি সঠিক?",i & ii,i & iii,ii & iii,"i, ii & iii",i ও ii,i ও iii,ii ও iii,"i, ii ও iii",d
Which of the following have contain malic acid?,নিচের কোনটিতে ম্যালিক এসিড পাওয়া যায়?,apple,grape,orange,lime,আপেল,আঙুর,কমলা,বাতাবি লেবু,a
Which one is from the phylum annclida?,কোনটি Annelida পর্বের প্রাণী?,Butterfly,Round worm,Leach,Crab,প্রজাপতি,গোলকৃমি,জোঁক,কাঁকড়া,c
Which one is the first arificial satellite for remote sensing?,রিমোট সেনসিং বা দূর অনুধাবনের জন্য পাঠানো প্রথম কৃত্রিম উপগ্রহের নাম কী?,Appolo souz,Land set-1,Vostok-1,Explorer-1,অ্যাপোলো-সুযোজ,ল্যান্ডসেট-১,ভস্টক-১,এক্সপ্লোরার-১,b
