English Question,Bengali Question,A,B,C,D,A Bn,B Bn,C Bn,D Bn,Correct Answer
Which acid present in tamarind?,তেঁতুলে কোন এসিড থাকে?,Malic,Citric,Oxalic,Tartaric,ম্যালিক,সাইট্রিক,অক্সালিক,টারটারিক,d
By which two elements fuse is made?,কোন মৌল দুটির সাহায্যে ফিউজ প্রস্তুত করা হয়?,Lead and Zinc,Zinc and Tin,Lead and Tin,Lead and Iron,সীসা ও জিঙ্ক,জিঙ্জ ও টিন,সীসা ও টিন,সীসা ও লোহা,c
Which on is the tertiary consumer of sundarbans?,সুন্দরবনের তৃতীয় স্তরের খাদক কোনটি?,Pig,Deer,Monkey,Hen,শুকর,হরিণ,বানর,মুরগি,a
Which hormone is sybtgesuzed in leaves?,পাতায় উৎপন্ন হরমোন কোনটি?,Auxin,Ethylene,Florigen,Gibberellin,অক্সিন,ইথিলিন,ফ্লোরিজেন,জিব্বেরেলিন,c
Which one is used as insecticide?,ফসলের ক্ষতিকর পেস্ট দমন করে কোনটি?,NH_{4}OH,NaOH,Mg(OH)_{2},Ca(OH)_{2},NH_{4}OH,NaOH,Mg(OH)_{2},Ca(OH)_{2},d
How much energy can get from 10gm butter,১০ গ্রাম মাখন থেকে কত কিলোক্যালরি শক্তি পাওয়া যায়?,40 Kilocalorie,45 Kilocalorie,64 Kilocalorie,90 Kilocalorie,৪০ কিলোক্যালরি,৪৬ কিলোক্যালরি,৬৪ কিলোক্যালরি,৯০ কিলোক্যালরি,d
Which one is the characteristic of platypus?,প্লাটিপাসের বৈশিষ্ট্য কোনটি?,The sucked milk from mammary gland,Cold blooded animal,They move by crawling,They give birth of child,মতৃদুগ্ধ পান করে,শীতল রক্তবিশিষ্ট,বুকে ভর করে চলে,সন্তান প্রসব করে,a
"CaCO_{3}\xrightarrow[]{heat}CaO+Z 
 'Z' componun-
 i. helps to stop firing 
 ii. Helps to occur phtosynthesis
 iii. Create the lime water opaque
 Which one is correct?","CaCO_{3}\xrightarrow[]{তাপ}CaO+Z
'Z' যৌগটি- 
 i. আগুন নিভাতে সাহায্য করে
 ii. সালোকসংশ্লেষণে সাহায্য করে
 iii. চুনের পানি ঘোলা করে
 নিচের কোনটি সঠিক?",i & ii,i & iii,ii & iii,"i, ii & iii",i ও ii,i ও iii,ii ও iii,"i, ii ও iii",d
"CaCO_{3}\xrightarrow[]{heat}CaO+Z
 How many atoms are in Z compund?","CaCO_{3}\xrightarrow[]{তাপ}CaO+Z
'Z' যৌগটিতে পরমাণুর সংখ্যা কত?",2,3,4,5,2,3,4,5,b
In which stage of cell division centromere is presented in every chromatid?,কোষ বিভাজনের কোন ধাপে প্রত্যেক ক্রোমোটিডে একটি সেস্ট্রোমিয়ার থাকে?,Prophase,Pro-metaphase,Metaphase,Anapase,প্রোফেজ,প্রোমেটাফেজ,মেটাফেজ,অ্যানাফেজ,d
Which satellite helps to watch the World Cup Cricket-2019?,“বিশ্বকাপ ক্রিকেট ২০১৯” দেখতে সাহায্য করেছিল কোন উপগ্রহ?,Communication satellite,Weather satellite,Military Satellite,Earth observation satellite,যোগাযোগ,আবহাওয়া,সামরিক,পৃথিবী পর্যবেক্ষণকারী,a
What is the atomic number of neon?,নিয়নের পারমাণবিক সংখ্যা কত?,8,9,10,11,8,9,10,11,c
Which one is the animal pollinated flower?,প্রাণীপরাগী ফুল কোনটি?,China rose,Shimul,Mustard,Pumpkin,জবা,শিমুল,সরিষা,কুমড়া,b
"The symptoms of anemia is-
 i. loss of weight
 ii. Loss of appetite 
 iii. Weakness
 Which one is correct?","অ্যানিমিয়া রোগের লক্ষণ-
 i. ওজন কমে যাওয়া
 ii. খাওয়ায় অনীহা 
 iii. দুর্বল লাগা 
 নিচের কোনটি সঠিক?",i & ii,i & iii,ii & iii,"i, ii & iii",i ও ii,i ও iii,ii ও iii,"i, ii ও iii",d
What is the electron distribution of Mg^{2+} ?,Mg^{2+} এর ইলেকট্রনবিন্যাস কোনটি?,"2,8","2,8,1","2,8,2","2,8,4","২,৮","২,৮,১","২,৮,২","২,৮,৪",a
What is the next planet of earth in solar system?,সৌরজগতে পৃথিবীর পরের গ্রহটির নাম কী?,Uranus,Jupiter,Mars,Saturn,ইউরেনাস,বৃহস্পতি,মঙ্গল,শনি,c
Where the value of 'g' is zero?,কোথায় G এর মান শুণ্য?,At polar region,At the equator,On earth surface,At the center of the earth,মেরু অঞ্চলে,বিষুবীয় অঞ্চলে,পৃথিবীর পৃষ্ঠে,পৃথিবীর কেন্দ্রে,d
Which vitamin helps in blood coagularion?,কোন ভিটামিন রক্ত জমাট বাঁধতে সাহায্য করে?,Vitamin e,Vitamin K,Vitamin D,Vitamin B,ভিটামিন এ,ভিটামিন কে,ভিটামিন বি,ভিটামিন ডি,b
Which is know as the connector of brin?,কোনটিকে মস্তিষ্কের যোজক বলা হয়?,Medulla,Pons,Cerebellum,Cerebrum,মেডুলা,পনস,সেরিবেলাম,সেরিব্রাম,b
By which one the reproduction of segun plant is occurred?,সেগুন উদ্ভিদের প্রজনন হয় কোনটির সাহয্যে?,Through root,Segmentation,Through stem,Through leaves,মূলের সাহায্যে,দেহেরে সাহায্যে,কান্ডের সাহায্যে,পাতার সাহায্যে,a
Which is the largest phylum is animal kingdom?,প্রাণিজগতের বৃহত্তপর্ব কোনটি?,Porifera,Mollusca,Arthropoda,Chordata,পরিফেরা,মলাস্কা,অর্থ্রোপোডা,কর্ডাটা,c
Which pollination occurs through wind?,বাতাসের মাধ্যমে কোনটির পরাগায়ন ঘটে?,Rice,Mustard,Shimul,Pumpkin,ধান,সরিষা,শিমুল,কুমড়া,a
What is the unit of resistance?,রোধের একক কী?,Ohm,Volt,Unit,Ampere,ওহম,ভোল্ট,ইউনিট,অ্যাম্পিয়ার,a
In which step the shape of the chromosomes as like English alphabet 'J' in mitosis cell division?,মাইটোসিসের কোনধারে ক্রোমোজোমগুলো ইংরেজি বর্ণমালা J এর মত হয়?,Prophsase,Metaphase,Anaphase,Telophase,প্রফেজ,মেটাফেজ,এনাফেজ,টেলোফেজ,c
The atomic number of an element is 17 and mas-number 35. What is the neuton number of the element,একটি মৌলের পারমাণবিক সংখ্যা ১৭ এবং ভরসংখ্যা ৩৫। এই মৌলের নিউট্রন সংখ্যা কত?,15,16,17,18,15,16,17,18,d
Which one is responsible for falling mango,আম ঝড়ে পড়ার জন্য দায়ী কোনটি?,Auxin,Gibberellins,Ethylene,Cytokinins,অক্সিন,জিব্বেরেলিন,ইথিলিন,সাইটোকইনিন,c
Which one is rhizome?,নিচের কোনটি রাইজোম,Potato,Ginger,Garlic,Arum,আলু,আদা,রসুন,কচু,b
What is the mass of an astronaut in th Moon when the mass of this astronaut is 70 kg on earh,৭০ কেজি ভরের একজন মহাশূন্যচারীর চাঁদে ভর কত হবে?,11.67 kg,70 kg,420 kg,686 kg,১১.৬৭ কেজি,৭০ কেজি,৪২০ কেজি,৬৮৬ কেজি,b
"Age of fossil can be know-
 i. by observing the decay of isotope 
 ii. By observing the decay of fossil 
 from the ratio of stable and non-stsble isotope
 Which one is correct?","ফসিলের বয়স জানা যায়- 
 i. আইসোটোপের ক্ষয় দেখে 
 ii. ফসিলের ক্ষয় দেখে 
 iii. স্থায়ী ও অস্থায়ী আইসোটোপের অনুপাত থেকে
 নিচের কোনটি সঠিক?",i & ii,i & iii,ii & iii,"i, ii & iii",i ও ii,i ও iii,ii ও iii,"i, ii ও iii",b
Which on is positive compound?,কোনটি ধনাত্মক যৌগমূলক?,Sulphate,Carbonate,Phosphate,Ammonium,সালফেট,কার্বনেট,ফসফেট,অ্যামোনিয়ামম,d
"The reason for birds fly-
 i. having air sac 
 ii. For the front legs are converted into wings 
 iii. For bones are strong and hollow
 Which one is correct?","পাখিরা উড়তে পারে কারণ-
 i. বায়ুথলি আছে 
 ii. সামনের পা ডানায় রূপান্তরিত হয় 
 iii. হাড় শক্ত ও ফাঁপা 
 নিচের কোনটি সঠিক?",i & ii,i & iii,ii & iii,"i, ii & iii",i ও ii,i ও iii,ii ও iii,"i, ii ও iii",d
Which disease occur for not eating lemon like fruits?,লেবুজাতীয় ফল না খাওয়ার ফলে কোন রোগটি হয়?,Scurvy,Rickets,Merasmus,K washiorkor,স্কার্ভি,রিকেটস,ম্যারাসমস,কোয়াশিয়রকর,a
The value of 'g' is greater in-,G এর মান সবচেয়ে বেশি-,Pole region,Equatorial region,Tropical region,Center of the Earth,মেরু অঞ্চলে,বিষুবীয় অঞ্চলে,ক্রাস্তীয় অঞ্চলে,পৃথিবীর কেন্দ্রে,a
Which is the structure element of our body?,আমাদের দেহের গঠন উপাদান কোনটি?,Protein,Carbohydrates,Fat,Vitamis,আমিষ,শর্করা,স্নেহ,ভিটামিন,a
How many satellites Saturn has,শনির উপগ্রহ কয়টি?,63,34,27,13,63,34,27,13,*
"NaOH+ HCI \rightarrow X+ H_{2}O
 In this reaction the 'X' compound is-",NaOH + HCI \rightarrow  X+ H_{2}O বিক্রিয়ার 'X' যৌগটি-,Acid,Base,Salt,Alkali,এসিড,ক্ষার,লবণ,ক্ষারক,c
Which phyum does obelia belong to,obelia কোন পর্বের প্রাণী?,Cnidaria,Platyhelminthes,Nematoda,Annelida,নিডারিয়া,প্লাটিহেলমিনথেস,নেমাটোডা,অ্যানিলিডা,a
What is the valencly of Aluminium?,অ্যালুমিনিয়ামের যোজনী কত?,1,2,3,4,1,2,3,4,c
What percentage of sunlight is used by green plants in the photosynthesis process?,সূর্যের আলোর শতকরা কতভাগ সবুজ উদ্ভিদ সালোকসংশ্লেষণে কাজে লাগায়?,1,2,3,4,1,2,3,4,b
Which maintains the moisture of the leaves?,পাতার আর্দ্রতা বজায় রাখে কোনটি?,Transpiration,Diffussion,Osmosis,Absorption,প্রস্বেদন,ব্যাপন,অভিস্রবন,শোষণ,a
How manyh paris of chromosomes are there in the human body?,মানবদেহে কত জোড়া ক্রোমোজোম থাকে?,22,23,24,25,22,23,24,25,b
The main element of making soap is-,সাবান তৈরির মূল উপাদান,acid,alkali,satl,glycerlin,এসিড,ক্ষারক,লবণ,গ্লিসারিন,b
The front part of the selera is called-,শ্বেতমন্ডলের সামনের অংশকে বলে-,cornea,iris,pupil,retina,কর্ণিয়া,আইরিশ,পিউপিল,রেটিনা,a
"There is 8 protons and 8 neutrons in an atom oif an element. 
 What is the name of the element?","কোন মৌলের একটি পরমাণুতে ৮টি প্রোটন ও ৮টি নিউট্রন আছে। 
 মৌলটির নাম কী?",Nitrogen,Oxygen,Fluorine,Chlorine,নাইট্রোজেন,অক্সিজেন,ফ্লোরিন,ক্লোরিন,b
"There is 8 protons and 8 neutrons in an atom oif an element. 
 What is the mass-number of the element?","কোন মৌলের একটি পরমাণুতে ৮টি প্রোটন ও ৮টি নিউট্রন আছে।
মৌলটির ভরসংখ্যা কত?",8,16,0,18,8,16,0,18,b
Which helps to clot blood?,রক্ত জমাট বাঁধতে সাহায্য করে কোনটি?,Vitamin A,Vitamin C,Vitamin B,Vitamin K,ভিটামিন এ,ভিটামিন সি,ভিটামিন বি,ভিটামিন কে,d
"The satellite included in artificial satellite is-
 i. weather satellite 
 ii. Military satellite 
 iii. Navigation satellite
 Which one is correct?","কৃত্রিম উপগ্রহের অন্তর্ভূক্ত উপগ্রহগুলো- 
 i. আবহাওয়া উপগ্রহ 
 ii. সামরিক উপগ্রহ 
 iii. নৌ পরিবহন উপগ্রহ 
 নিচের কোনটি সঠিক?",i & ii,i & iii,ii & iii,"i, ii & iii",i ও ii,i ও iii,ii ও iii,"i, ii ও iii",d
"Mr. Karim has fruit shop. He uses one kind of chemical to ripen green fruits. 
 What is the name of the chemical?","করিম সাহেবের ফলের দোকান আছে। তিনি কাঁচা ফলগুলো পাকাতে এক ধরনের রাসায়নিক পদার্থ ব্যবহার করনে। 
 রাসায়নিক পদার্থটির নাম কি?",Auxin,Ethylene,Gibberellins,Abscisic Acid,অক্সিন,ইথিলিন,জিব্বেরেলিন,অ্যাবসাইসিক এসিড,b
"Mr. Karim has fruit shop. He uses one kind of chemical to ripen green fruits.
 The characteristic of this chemical is-
 i. root grow up in cutting
 ii. Found in leaves and roots
 iii. Seedling gives rise to the stem of the tree
 Which one is correct?","করিম সাহেবের ফলের দোকান আছে। তিনি কাঁচা ফলগুলো পাকাতে এক ধরনের রাসায়নিক পদার্থ ব্যবহার করনে।
উক্ত রাসায়নিক পদাথের বৈশিষ্ট্য-
 i. শাখা কলমে মূল গজায়
 ii. পাতা ও মূলে দেখা যায়
 iii. চারা গাছের কান্ডের বৃদ্ধি ঘটায় 
 নিচের কোনটি সঠিক?",i & ii,i & iii,ii & iii,"i, ii & iii",i ও ii,i ও iii,ii ও iii,"i, ii ও iii",c
Which one belongs to platyhelminthes phylum?,কোনটি প্লাটিহেলমিনথেস পর্বের প্রাণী?,Tape worm,Round worm,Earth worm,Leech,ফিতাকৃমি,গোলকৃমি,কেঁচো,জোঁক,a
What is peperomia?,পেপারেমিয়া কীসের নাম?,A plant,A disease,A mdecine,An animal,গাছের,রোগের,ঔষধের,প্রাণীর,a
"Plant absorbs mineral slta from soil-
 i. By inactive absorption 
 ii. By active absorption 
 iii. By the absorption of water 
 Which one of following is correct?","মাটি থেকে উদ্ভিদের খনিজ লবণ শোষণ সম্পন্ন হয়-
 i. নিষ্কিয় শোষণের মাধ্যমে 
 ii. সক্রিয় শোষণের মাধ্যমে
 iii. পানি শোষণের মাধ্যমে 
 নিচের কোনটি সঠিক",i & ii,i & iii,ii & iii,"i, ii & iii",i ও ii,i ও iii,ii ও iii,"i, ii ও iii",a
"CuCO_{3}\xrightarrow[]{heat}A+CO_{2}
 In the 'A' marked position of the equation there is-","CuCO_{3}\xrightarrow[]{তাপ}A+CO_{2}
 সমীকরণের A চিহ্নিত স্থানে বসবে-",Cu,O_{2},Cu_{2}O,CuO,Cu,O_{2},Cu_{2}O,CuO,d
"CucO3-A+CO2
 What type of stem's rection is?","CuCO_{3}\xrightarrow[]{তাপ}A+CO_{2}
উদ্দীপকের বিক্রিয়াটি কোন ধরনের?",Addition,Decomposition,Substitution,Combustion,সংযোজন,বিয়োজন,প্রতিস্থাপন,দহন,b
How many types of nucleic acid are there?,নিউক্লিক এসিড কয় ধরনের,1,2,3,4,1,2,3,4,b
How many types of cell division are there in the animal body?,জীবদেহে কয় ধরনের কোষ বিভাজন দেখা যায়?,2,3,4,5,2,3,4,5,b
Form each eye an individual plant grows- Which one of the following is that plant?,প্রতিটি চোখ থেকে একটি স্বাধীন উদ্ভিদের জন্ম হয়। সেই উদ্ভিদ নিচের কোনটি?,Potato,Ginger,Pudina,Garlic,আলু,আদা,পুদিনা,রসুন,a
"Vegetative reproduction of plants means-
 i. reproduction by segmentation of plants 
 ii. reproduction through root
 iii. Reproduction by without reproductive cell
 Which one of following is correct?","উদ্ভিদের অঙ্গজ প্রজনন বলতে বুঝায়- 
 i. দেহের খন্ডায়নের সাহায্যে বংশবৃদ্ধি
 ii. মূলের সাহায্যে বংশবৃদ্ধি 
 iii. জনন কোষ ছাড়া বংশবৃদ্ধি",i & ii,i & iii,ii & iii,"i, ii & iii",i ও ii,i ও iii,ii ও iii,"i, ii ও iii",d
How many electron are there in the element oxygen?,অক্সিজেন মৌলটিতে ইলেকট্রন সংখ্যা কত?,2,6,8,16,2,6,8,16,c
The value of acceleration due to gravity 'g' is higher in_,অভিকর্ষজ ত্বরণ G এর মান সবচেয়ে বেশি-,equator region,polar region,at the center of the earth,at moon,বিষুব অঞ্চলে,মেরু অঞ্চলে,পৃথিবীর কেন্দ্রে,চাঁদে,b
"There is a larges phylum in the animal kingdom. In this phylum, they can survive everywhere on land, in fresh water and in brackish sea water. Many species of this phylum can fly with the help of wings. 
 Which characteristics of the following are observed in the above phylum?
 i. Body is segmented and joint appendages are present.
 ii. Body cavity filled with blood and is know as haemocoel
 iii. Body tubular and covered with thick skin
 Which one is correct?","প্রাণিজগতের সবচেয়ে বৃহত্তম একটি পর্ব আছে। যে পর্বে পৃথিবীর প্রায় সর্বত্র সকল পরিবেশে, স্থলে সাদু পানি ওসমুদ্রে বাস করে। এ পর্বের অনেক প্রজাতির প্রাণী ডানার সাহায্যে উড়তে পারে।
উক্ত পর্বে নিচের কোন কোন বৈশিষ্ট্যগুলো লক্ষ্য করা যায়? 
 i. দেহ বিভিন্ন অঞ্চলে বিভক্ত ও সন্ধিযুক্ত উপাঙ্গ বিদ্যমান 
 ii. দেহের রক্তপূর্ণ গহ্বর হিমোসিলা নামে পরিচিত
 iii. দেহ নলাকার ও পুরু ত্বক দ্বারা আবৃত
 নিচের কোনটি সঠিক?",i & ii,i & iii,ii & iii,"i, ii & iii",i ও ii,i ও iii,ii ও iii,"i, ii ও iii",a
Which one of the followings is termed as the facroty of urine production?,নিচের কোনটিকে মূত্র তৈরিরি কারখানা হিসেবে অভিহিত করা যায়?,Lung,Skin,Liver,Kidney,ফুসফুস,ত্বক,যকৃত,বৃত্ত,d
"In the Newton law of gravitation-
 i. every particle in the unverse attracts each other
 ii. The force of attraction is proportional to the product of their masses 
 iii. The force of attraction is proportional to the square of the distance between them
 Which one is correct?","নিউটনের মহাকর্ষ সূত্রের ক্ষেত্রে- 
 i. মহাবিশ্বের প্রতিটি বস্তুকণা একে অপরকে নিজের দিকে আকর্ষণ করে
 ii. আকর্ষণ বলের মান বস্তুকণাদ্বয়ের ভরের গুণফলে সমানুপাতিক 
 iii. আকর্ষণ বলের মান বস্তুর দূরত্বের বর্গের সমানুপাতিক
 নিচের কোনটি সঠিক?",i & ii,i & iii,ii & iii,"i, ii & iii",i ও ii,i ও iii,ii ও iii,"i, ii ও iii",a
In the burning of candle what type of energy is transformed?,মোম প্রজ্বলনে কোন শক্তির পরিবর্তন ঘটে?,Electric energy,Light energy,Heat energy,Chemical energy,বিদ্যুৎশক্তি,আলোকশক্তি,তাপশক্তি,রাসায়নিক শক্তি,d
What is the international unit of mass?,আন্তর্জাতিক পদ্ধতিতে ভরের একক কোনটি?,Centigram,Kg,Quintal,Gram,সেন্টিগ্রাম,কেজি,কুইন্টাল,গ্রাম,b
How many electrons are there in the outemost orbit of sodium atom?,সোডিয়াম পরমাণুর সর্বশেষ শক্তিস্তরে কয়টি ইলেকট্রন থাকে?,1,2,8,11,1,2,8,11,a
Which one is fleshy fruits?,কোনটি রসাল ফল?,Bean,Lady's finger,Mango,Mustard,শিম,ঢেঁড়স,আম,সরিষা,c
Which one of the following is formula of vinegar?,ভিনেগারের সংকেত নিচের কোনটি?,HOOC-COOH,H_{2}SO_{4},HCI,CH_3COOH,HOOC-COOH,H_{2}SO_{4},HCI,CH_{3}COOH,d
"Hydrogen+Oxygen\rightarrow Water. 
 i. Addition reaction 
 ii. Combustion reaction
 iii. Substitution reaction
 Which one is correct?","হাইড্রোজেন+ অক্সিজেন \rightarrow  পানি--
 i. সংযোজন বিক্রিয়া 
 ii. দহন বিক্রিয়া 
 iii. প্রতিস্থাপন বিক্রিয়া
 নিচের কোনটি সঠিক?",i & ii,i & iii,ii & iii,"i, ii & iii",i ও ii,i ও iii,ii ও iii,"i, ii ও iii",a
"For the deficiency of which vitamin, night blindness disease is occurred?",কোন ভিটামিনের অভাবে রাতকানা রোগ হয়?,C,D,A,E,সি,ডি,এ,ই,c
"Which hormone is presen in fruits, flowers, seeds, leaves and roots?","ফল, ফুল, বীজ, পাতা ও মূলে কোনহরমোনটি দেখা যায়?",Auxin,Gibberellin,Ethylene,Cytokinins,অক্সিন,জিব্বেরেলিন,ইথিলিন,সাইটোকইনিন,c
"Moni is playing cricket at the roof of a bilding suddenly, the bat of mass 2000 gram is falling down from his hand. 
 What is the weight of Moni's bat?"," দালানের ছাদে মণি ক্রিকেট খেলছিল। এক পর্যায়ে ২০০ গ্রাম ভরের ব্যাটটি হাত থেকে নিচে পড়ে গেল। 
 মণির ব্যাটের ওজন কত?",19.6 Newton,20.41 Newton,196 Newton,19600 Newton,19-6 নিউটন,20-41 নিউটন,196 নিউটন,19600 নিউটন,a
"Moni is playing cricket at the roof of a bilding suddenly, the bat of mass 2000 gram is falling down from his hand. 
 The above phenomenon occurred-
 i. due to acceleration due to gravity
 ii. Due to gravitational force 
 iii. Due to the attracton of earth
 Which one of following is correct?","দালানের ছাদে মণি ক্রিকেট খেলছিল। এক পর্যায়ে ২০০ গ্রাম ভরের ব্যাটটি হাত থেকে নিচে পড়ে গেল।
উল্লিখিত ঘটনাটি- 
 i. অভিকর্ষজ ত্বরণের কারণে
 ii. মহাকর্ষ বলের কারণে
 iii. পৃথিবীর আকর্ষণের কারণে
 নিচের কোনটি সঠিক?",i & ii,i & iii,ii & iii,"i, ii & iii",i ও ii,i ও iii,ii ও iii,"i, ii ও iii",d
Actually what is Sclera?,চোখের শ্বেতমন্ডল মূলত কী?,Cornea,Light sensitive membrance,Circular hole,Opaque covering,কর্ণিয়া,আলোকগ্রাহী পর্দা,গোলাকার ছিদ্রপথ,অস্বচ্ছ আবরণ,d
